{
  "pack_id": "auditvocab",
  "version": "0.2.0",
  "name": "ENKI Audit Event Vocabulary Pack",
  "description": "Canonical vocabulary for audit events (event types, fields, severity levels)",
  "definitions": [
    {
      "id": "audit.vocab.system",
      "path": "definitions/auditvocab.system.json",
      "type": "system"
    },
    {
      "id": "audit.vocab.event.types",
      "path": "definitions/auditvocab.event_types.json",
      "type": "custom"
    },
    {
      "id": "audit.vocab.fields",
      "path": "definitions/auditvocab.fields.json",
      "type": "custom"
    },
    {
      "id": "audit.vocab.severity",
      "path": "definitions/auditvocab.severity.json",
      "type": "custom"
    }
  ],
  "dependencies": [],
  "namespaces_owned": [
    "audit.vocab"
  ],
  "metadata": {
    "created": "2025-12-31T00:00:00Z",
    "author": "ENKI System",
    "license": "TBD"
  }
}
