{
  "pack_id": "identity",
  "version": "0.2.0",
  "name": "ENKI Identity Pack",
  "description": "Canonical vocabulary for identity primitives (actors, entities, scopes)",
  "definitions": [
    {
      "id": "identity.system",
      "path": "definitions/identity.system.json",
      "type": "system"
    },
    {
      "id": "identity.actors",
      "path": "definitions/identity.actors.json",
      "type": "custom"
    },
    {
      "id": "identity.entities",
      "path": "definitions/identity.entities.json",
      "type": "custom"
    },
    {
      "id": "identity.scopes",
      "path": "definitions/identity.scopes.json",
      "type": "custom"
    }
  ],
  "dependencies": [],
  "namespaces_owned": [
    "identity"
  ],
  "metadata": {
    "created": "2025-12-31T00:00:00Z",
    "author": "ENKI System",
    "license": "TBD"
  }
}
